Заколдованная Элла,Ella Enchanted,https://www.kinopoisk.ru/film/1713/,Томми О’Хейвер,США,2004,фэнтези,"Энн Хэтэуэй, Хью Дэнси",96.0,6.8,69 719
"Я люблю тебя, Филлип Моррис",I Love You Phillip Morris,https://www.kinopoisk.ru/film/402550/,Гленн Фикарра,Франция,2008,драма,"Джим Керри, Юэн Макгрегор",102.0,6.9,69 719
Крутые меры,Bastille Day,https://www.kinopoisk.ru/film/678233/,Джеймс Уоткинс,Великобритания,2016,боевик,"Идрис Эльба, Ричард Мэдден",92.0,6.8,69 717
Смурфики,The Smurfs,https://www.kinopoisk.ru/film/178591/,Раджа Госнелл,США,2011,мультфильм,"Хэнк Азария, Нил Патрик Харрис",103.0,6.1,69 609
Больше чем любовь,A Lot Like Love,https://www.kinopoisk.ru/film/77466/,Найджел Коул,США,2005,мелодрама,"Аманда Пит, Эштон Кутчер",107.0,7.5,69 566
Бруно,Brüno,https://www.kinopoisk.ru/film/271802/,Ларри Чарльз,США,2009,комедия,"Саша Барон Коэн, Густаф Хаммарстен",81.0,5.8,69 552
Четвёртый вид,The Fourth Kind,https://www.kinopoisk.ru/film/410267/,Олатунде Осунсанми,США,2009,ужасы,"Милла Йовович, Уилл Пэттон",98.0,6.2,69 551
На острие,,https://www.kinopoisk.ru/film/1311064/,Эдуард Бордуков,Россия,2020,драма,"Светлана Ходченкова, Стася Милославская",115.0,7.8,69 532
Ёлки 5,,https://www.kinopoisk.ru/film/893500/,Тимур Бекмамбетов,Россия,2016,семейный,"Константин Хабенский, Иван Ургант",88.0,4.8,69 521
Щелкунчик и волшебная флейта,,https://www.kinopoisk.ru/film/1435400/,Виктор Глухушин,Россия,2022,мультфильм,"Фёдор Федотов, Любовь Аксёнова",88.0,7.9,69 490
Возвращение домовёнка,,https://www.kinopoisk.ru/film/45882/,Аида Зябликова,СССР,1987,мультфильм,"Георгий Вицин, Светлана Травкина",10.0,8.1,69 380
"Дикий, дикий Запад",Wild Wild West,https://www.kinopoisk.ru/film/2762/,Барри Зонненфельд,США,1999,фантастика,"Уилл Смит, Кевин Клайн",106.0,6.8,69 368
Миссис Даутфайр,Mrs. Doubtfire,https://www.kinopoisk.ru/film/5939/,Крис Коламбус,США,1993,драма,"Робин Уильямс, Салли Филд",125.0,7.7,69 365
Ищу друга на конец света,Seeking a Friend for the End of the World,https://www.kinopoisk.ru/film/464573/,Лорин Скафария,США,2011,фантастика,"Стив Карелл, Кира Найтли",101.0,6.7,69 326
Саранча,,https://www.kinopoisk.ru/film/838049/,Егор Баранов,Россия,2013,триллер,"Пётр Фёдоров, Паулина Андреева",118.0,6.5,69 325
8 женщин,8 femmes,https://www.kinopoisk.ru/film/580/,Франсуа Озон,Франция,2001,мюзикл,"Виржини Ледуайен, Даниель Дарьё",110.0,7.6,69 317
Последняя смена,Last Shift,https://www.kinopoisk.ru/film/770917/,Энтони ДиБлази,США,2014,ужасы,"Джулиана Харкви, Джошуа Микель",87.0,5.7,69 235
Кот Гром и заколдованный дом,The House of Magic,https://www.kinopoisk.ru/film/751952/,Жереми Дегрюсон,Бельгия,2013,мультфильм,"Брианн Брози, Джордж Бэббит",85.0,6.8,69 213
Иллюзия полета,Flightplan,https://www.kinopoisk.ru/film/81873/,Роберт Швентке,США,2005,триллер,"Джоди Фостер, Питер Сарсгаард",98.0,7.1,69 208
Холодное торжество,Frozen Fever,https://www.kinopoisk.ru/film/842477/,Крис Бак,США,2015,мультфильм,"Кристен Белл, Идина Мензел",8.0,7.3,69 194
Необычайные приключения Адель,Les aventures extraordinaires d'Adèle Blanc-Sec,https://www.kinopoisk.ru/film/462666/,Люк Бессон,Франция,2010,фэнтези,"Луиз Бургуэн, Матьё Амальрик",107.0,6.3,69 191
Бандитки,Bandidas,https://www.kinopoisk.ru/film/81102/,Хоаким Роннинг,Франция,2006,боевик,"Пенелопа Крус, Сальма Хайек",93.0,6.7,69 159
Тринадцатый этаж,The Thirteenth Floor,https://www.kinopoisk.ru/film/1086/,Йозеф Руснак,США,1999,фантастика,"Крэйг Бирко, Гретхен Мол",100.0,7.6,68 966
Космос между нами,The Space Between Us,https://www.kinopoisk.ru/film/924990/,Питер Челсом,США,2016,фантастика,"Бритт Робертсон, Эйса Баттерфилд",120.0,6.6,68 962
База «Клейтон»,Basic,https://www.kinopoisk.ru/film/4572/,Джон Мактирнан,США,2003,боевик,"Джон Траволта, Сэмюэл Л. Джексон",98.0,7.3,68 951
Женитьба Бальзаминова,,https://www.kinopoisk.ru/film/45300/,Константин Воинов,СССР,1964,комедия,"Георгий Вицин, Людмила Шагалова",90.0,8.0,68 894
Королевский роман,En kongelig affære,https://www.kinopoisk.ru/film/461124/,Николай Арсель,Дания,2012,драма,"Алисия Викандер, Мадс Миккельсен",137.0,7.6,68 854
"Привет, Джули!",Flipped,https://www.kinopoisk.ru/film/470037/,Роб Райнер,США,2010,драма,"Мадлен Кэрролл, Каллэн МакОлифф",90.0,7.8,68 850
Игла,,https://www.kinopoisk.ru/film/42576/,Рашид Нугманов,СССР,1988,триллер,"Виктор Цой, Марина Смирнова",76.0,7.4,68 829
Падение ангела,Angel Has Fallen,https://www.kinopoisk.ru/film/1007842/,Рик Роман Во,США,2019,боевик,"Джерард Батлер, Морган Фриман",120.0,6.5,68 822
Робин Гуд,Robin Hood,https://www.kinopoisk.ru/film/17579/,Вольфганг Райтерман,США,1973,мультфильм,"Роджер Миллер, Питер Устинов",83.0,8.1,68 730
Соломон Кейн,Solomon Kane,https://www.kinopoisk.ru/film/279791/,М. Дж. Бассетт,Чехия,2009,ужасы,"Джеймс Пьюрфой, Макс фон Сюдов",104.0,6.1,68 663
Тарзан,Tarzan,https://www.kinopoisk.ru/film/2260/,Крис Бак,США,1999,мультфильм,"Тони Голдуин, Брайан Блессид",85.0,7.7,68 647
Король вечеринок,National Lampoon's Van Wilder,https://www.kinopoisk.ru/film/6519/,Уолт Бекер,Германия,2001,мелодрама,"Райан Рейнольдс, Тара Рид",92.0,7.0,68 627
Голос монстра,A Monster Calls,https://www.kinopoisk.ru/film/839600/,Хуан Антонио Байона,Великобритания,2016,фэнтези,"Льюис МакДугалл, Лиам Нисон",108.0,7.4,68 597
Республика ШКИД,,https://www.kinopoisk.ru/film/42088/,Геннадий Полока,СССР,1966,драма,"Сергей Юрский, Юлия Бурыгина",103.0,8.2,68 440
Затерянные во льдах,Arctic,https://www.kinopoisk.ru/film/1069265/,Джо Пенна,США,2018,драма,"Мадс Миккельсен, Мария Тельма Смарадоттир",97.0,6.8,68 438
Статский советник,,https://www.kinopoisk.ru/film/94111/,Филипп Янковский,Россия,2005,драма,"Никита Михалков, Олег Меньшиков",127.0,7.4,68 409
Репортаж,[Rec],https://www.kinopoisk.ru/film/325598/,Жауме Балагеро,Испания,2007,ужасы,"Мануэла Веласко, Ферран Терраса",75.0,7.0,68 409
Братец медвежонок,Brother Bear,https://www.kinopoisk.ru/film/8057/,Аарон Блейс,США,2003,мультфильм,"Хоакин Феникс, Джереми Суарес",82.0,7.9,68 371
Лимб,Haunter,https://www.kinopoisk.ru/film/676823/,Винченцо Натали,Канада,2013,ужасы,"Эбигейл Бреслин, Питер Аутербридж",97.0,6.1,68 312
Приговор,Conviction,https://www.kinopoisk.ru/film/418847/,Тони Голдуин,США,2010,драма,"Хилари Суэнк, Сэм Рокуэлл",107.0,7.7,68 297
Необратимость,Irréversible,https://www.kinopoisk.ru/film/715/,Гаспар Ноэ,Франция,2002,триллер,"Моника Беллуччи, Венсан Кассель",99.0,7.1,68 287
Призрак в доспехах,Koukaku Kidoutai,https://www.kinopoisk.ru/film/8228/,Мамору Осии,Япония,1995,аниме,"Ацуко Танака, Акио Оцука",82.0,8.0,68 225
Безумная свадьба,Qu'est-ce qu'on a fait au bon Dieu?,https://www.kinopoisk.ru/film/748663/,Филипп де Шоврон,Франция,2014,комедия,"Кристиан Клавье, Шанталь Лоби",94.0,7.3,68 222
Гагарин. Первый в космосе,,https://www.kinopoisk.ru/film/676361/,Павел Пархоменко,Россия,2013,драма,"Ярослав Жалнин, Михаил Филиппов",108.0,7.0,68 179
Здоровый человек,,https://www.kinopoisk.ru/film/2000122/,Петр Тодоровский,Россия,2022,драма,"Никита Ефремов, Ирина Старшенбаум",101.0,7.4,68 169
Служебный роман. Наше время,,https://www.kinopoisk.ru/film/468193/,Сарик Андреасян,Россия,2011,мелодрама,"Светлана Ходченкова, Владимир Зеленский",90.0,4.1,68 137
Классик,,https://www.kinopoisk.ru/film/41242/,Георгий Шенгелия,Россия,1998,боевик,"Сергей Никоненко, Юозас Будрайтис",101.0,7.8,68 120
Клуб любителей книг и пирогов из картофельных очистков,The Guernsey Literary and Potato Peel Pie Society,https://www.kinopoisk.ru/film/467760/,Майк Ньюэлл,Великобритания,2018,драма,"Лили Джеймс, Михил Хёйсман",124.0,7.6,68 043
Варяг,The Northman,https://www.kinopoisk.ru/film/1313198/,Роберт Эггерс,США,2022,фэнтези,"Александр Скарсгард, Николь Кидман",137.0,6.7,68 027
Свадьба лучшего друга,My Best Friend's Wedding,https://www.kinopoisk.ru/film/2768/,П.Дж. Хоган,США,1997,комедия,"Джулия Робертс, Дермот Малруни",105.0,7.2,68 025
Замёрзшие,Frozen,https://www.kinopoisk.ru/film/432713/,Адам Грин,США,2010,ужасы,"Эмма Белл, Шон Эшмор",89.0,6.3,68 016
Эверест,Abominable,https://www.kinopoisk.ru/film/1044976/,Джилл Калтон,США,2019,мультфильм,"Хлоя Беннет, Альберт Цай",97.0,7.5,67 942
Спасатель,The Guardian,https://www.kinopoisk.ru/film/104921/,Эндрю Дэвис,США,2006,драма,"Кевин Костнер, Эштон Кутчер",139.0,8.0,67 866
Звездные врата,Stargate,https://www.kinopoisk.ru/film/5594/,Роланд Эммерих,США,1994,фантастика,"Курт Рассел, Джеймс Спэйдер",116.0,7.6,67 751
"Крылья, ноги и хвосты",,https://www.kinopoisk.ru/film/325794/,Александр Татарский,СССР,1985,мультфильм,"Александр Филиппенко, Алексей Птицын",4.0,8.2,67 749
Ты умеешь хранить секреты?,Can You Keep a Secret?,https://www.kinopoisk.ru/film/1178301/,Элиз Дюран,США,2019,мелодрама,"Александра Даддарио, Сунита Мани",94.0,6.3,67 741
Выжившая,Revenge,https://www.kinopoisk.ru/film/1048767/,Корали Фаржа,Франция,2017,боевик,"Матильда Анна Ингрид Лутс, Кевин Янссенс",108.0,5.9,67 734
Крик 4,Scream 4,https://www.kinopoisk.ru/film/420072/,Уэс Крэйвен,США,2011,ужасы,"Нив Кэмпбелл, Дэвид Аркетт",111.0,6.1,67 724
Дело было в Пенькове,,https://www.kinopoisk.ru/film/44123/,Станислав Ростоцкий,СССР,1957,драма,"Майя Менглет, Вячеслав Тихонов",100.0,8.2,67 671
Если я останусь,If I Stay,https://www.kinopoisk.ru/film/463860/,Р.Дж. Катлер,США,2014,фантастика,"Хлоя Грейс Морец, Мирей Инос",107.0,6.9,67 629
Танцующий с волками,Dances with Wolves,https://www.kinopoisk.ru/film/2037/,Кевин Костнер,США,1990,драма,"Кевин Костнер, Мэри Макдоннелл",181.0,8.1,67 547
Возвращение героя,The Last Stand,https://www.kinopoisk.ru/film/489439/,Ким Джи-ун,США,2013,боевик,"Арнольд Шварценеггер, Форест Уитакер",107.0,6.6,67 521
Глубокое синее море,Deep Blue Sea,https://www.kinopoisk.ru/film/9528/,Ренни Харлин,США,1999,ужасы,"Томас Джейн, Саффрон Берроуз",105.0,7.0,67 507
Мужчины со слабостями,Come As You Are,https://www.kinopoisk.ru/film/1151998/,Ричард Вон,США,2019,драма,"Грант Розенмейер, Хейден Сзето",106.0,7.4,67 477
Король Стейтен-Айленда,The King of Staten Island,https://www.kinopoisk.ru/film/1236644/,Джадд Апатоу,США,2020,драма,"Пит Дэвидсон, Мариса Томей",136.0,7.2,67 470
Ослепленный желаниями,Bedazzled,https://www.kinopoisk.ru/film/12330/,Харольд Рэмис,Германия,2000,фэнтези,"Брендан Фрейзер, Элизабет Хёрли",93.0,7.2,67 435
"Доктор Стрейнджлав, или Как я научился не волноваться и полюбил атомную бомбу",Dr. Strangelove or: How I Learned to Stop Worrying and Love the Bomb,https://www.kinopoisk.ru/film/334/,Стэнли Кубрик,Великобритания,1963,комедия,"Питер Селлерс, Джордж К. Скотт",95.0,8.0,67 425
Киллер-хранитель,Deo killeo: jukeodo doeneun ai,https://www.kinopoisk.ru/film/4880777/,Чхве Джэ-хун,Корея Южная,2022,боевик,"Чан Хёк, Ли Со-ён",95.0,7.2,67 420
Мушкетёры,The Three Musketeers,https://www.kinopoisk.ru/film/474752/,Пол У. С. Андерсон,США,2011,боевик,"Логан Лерман, Милла Йовович",110.0,6.1,67 415
Ларго Винч: Начало,Largo Winch,https://www.kinopoisk.ru/film/274730/,Жером Салль,Франция,2008,боевик,"Томер Сисле, Кристин Скотт Томас",108.0,7.0,67 395
Кит,Keith,https://www.kinopoisk.ru/film/196855/,Тодд Кесслер,США,2008,драма,"Джесси МакКартни, Элизабет Арнуа",95.0,7.6,67 390
Дрожь земли,Tremors,https://www.kinopoisk.ru/film/18440/,Рон Андервуд,США,1989,ужасы,"Кевин Бейкон, Фред Уорд",96.0,7.3,67 347
Антихрист,Antichrist,https://www.kinopoisk.ru/film/408909/,Ларс фон Триер,Дания,2009,ужасы,"Уиллем Дефо, Шарлотта Генсбур",108.0,6.6,67 321
Большой,Big,https://www.kinopoisk.ru/film/4688/,Пенни Маршалл,США,1988,фэнтези,"Том Хэнкс, Элизабет Перкинс",104.0,7.9,67 247
Франкенвини,Frankenweenie,https://www.kinopoisk.ru/film/408395/,Тим Бёртон,США,2012,мультфильм,"Чарли Тахэн, Кэтрин О’Хара",87.0,7.1,67 237
Эта замечательная жизнь,It's a Wonderful Life,https://www.kinopoisk.ru/film/348/,Фрэнк Капра,США,1947,фэнтези,"Джеймс Стюарт, Донна Рид",130.0,8.4,67 228
Хостел,Hostel,https://www.kinopoisk.ru/film/102343/,Элай Рот,США,2005,ужасы,"Джей Эрнандес, Дерек Ричардсон",94.0,6.2,67 177
Бывшая с того света,Blithe Spirit,https://www.kinopoisk.ru/film/1265932/,Эдвард Холл,Великобритания,2020,комедия,"Дэн Стивенс, Айла Фишер",99.0,6.5,67 174
Пила,Saw,https://www.kinopoisk.ru/film/251613/,Джеймс Ван,США,2003,короткометражка,"Ли Уоннелл, Пол Модер",9.0,7.7,67 166
Последний дом слева,The Last House on the Left,https://www.kinopoisk.ru/film/261005/,Дэннис Илиадис,США,2009,ужасы,"Тони Голдуин, Моника Поттер",110.0,6.8,67 156
Звонок мертвецу,Abgeschnitten,https://www.kinopoisk.ru/film/914415/,Кристиан Альварт,Германия,2018,детектив,"Мориц Бляйбтрой, Ясна Фритци Бауэр",132.0,7.0,67 129
Хитмен. Последнее дело,Knox Goes Away,https://www.kinopoisk.ru/film/5094888/,Майкл Китон,США,2023,триллер,"Майкл Китон, Аль Пачино",114.0,7.7,67 126
Очень страшное кино 4,Scary Movie 4,https://www.kinopoisk.ru/film/32655/,Дэвид Цукер,США,2006,комедия,"Анна Фэрис, Реджина Холл",83.0,5.7,67 120
Сука-любовь,Amores perros,https://www.kinopoisk.ru/film/488/,Алехандро Гонсалес Иньярриту,Мексика,2000,триллер,"Эмилио Эчеваррия, Гаэль Гарсиа Берналь",153.0,7.9,67 080
Вам письмо,You've Got Mail,https://www.kinopoisk.ru/film/5330/,Нора Эфрон,США,1998,драма,"Том Хэнкс, Мег Райан",114.0,7.8,67 068
"Ну, здравствуй, Оксана Соколова!",,https://www.kinopoisk.ru/film/1045715/,Кирилл Васильев,Россия,2018,комедия,"Виктор Добронравов, Валентина Мазунина",99.0,6.3,67 051
Пламенное сердце,Fireheart,https://www.kinopoisk.ru/film/1172958/,Теодор Ти,Франция,2021,мультфильм,"Алис Поль, Венсан Кассель",92.0,7.7,67 043
Воспоминания убийцы,Sarinjaui gieokbeop,https://www.kinopoisk.ru/film/983082/,Вон Щин-ён,Корея Южная,2017,триллер,"Соль Гён-гу, Ким Нам-гиль",118.0,7.2,67 011
Путь домой,A Dog's Way Home,https://www.kinopoisk.ru/film/1100959/,Чарльз Мартин Смит,США,2019,мелодрама,"Брайс Даллас Ховард, Эшли Джадд",96.0,7.4,66 977
Никто не выжил,No One Lives,https://www.kinopoisk.ru/film/572458/,Рюхэй Китамура,США,2012,триллер,"Люк Эванс, Аделаида Клеменс",86.0,6.2,66 969
Ведьма,The VVitch: A New-England Folktale,https://www.kinopoisk.ru/film/865302/,Роберт Эггерс,США,2015,ужасы,"Аня Тейлор-Джой, Ральф Айнесон",92.0,6.6,66 965
Неистовый,Unhinged,https://www.kinopoisk.ru/film/1264589/,Деррик Борте,Великобритания,2020,боевик,"Карен Писториус, Рассел Кроу",90.0,6.3,66 965
Континуум,Project Almanac,https://www.kinopoisk.ru/film/711454/,Дин Израэлайт,США,2014,фантастика,"Джонни Уэстон, София Блэк-Д’Элиа",106.0,6.4,66 943
"Ганзель, Гретель и Агентство Магии",Secret Magic Control Agency,https://www.kinopoisk.ru/film/4312553/,Алексей Цицилин,Россия,2021,мультфильм,"Валерий Смекалов, Ирина Обрезкова",104.0,7.9,66 868
Цветик-Семицветик,,https://www.kinopoisk.ru/film/257883/,Михаил Цехановский,СССР,1948,мультфильм,"Наталья Защипина, Татьяна Барышева",20.0,8.0,66 832
Беглец,The Fugitive,https://www.kinopoisk.ru/film/3915/,Эндрю Дэвис,США,1993,боевик,"Харрисон Форд, Томми Ли Джонс",130.0,7.9,66 784
Рэмбо IV,Rambo,https://www.kinopoisk.ru/film/104952/,Сильвестр Сталлоне,США,2007,боевик,"Сильвестр Сталлоне, Джули Бенц",91.0,6.9,66 757
"Исчезнувшее время: Мальчик, который вернулся",Garyeojin sigan,https://www.kinopoisk.ru/film/1002665/,Ом Тхэ-хва,Корея Южная,2016,мелодрама,"Щин Ын-су, Кан Дон-вон",130.0,7.7,66 701
Благословите женщину,,https://www.kinopoisk.ru/film/41239/,Станислав Говорухин,Россия,2003,драма,"Светлана Ходченкова, Александр Балуев",114.0,7.9,66 675
Сайлент Хилл 2,Silent Hill: Revelation,https://www.kinopoisk.ru/film/276584/,М. Дж. Бассетт,Канада,2012,ужасы,"Аделаида Клеменс, Кит Харингтон",95.0,5.2,66 636
Первая ведьма,The Wretched,https://www.kinopoisk.ru/film/1145122/,Бретт Пирс,США,2019,ужасы,"Джон-Пол Ховард, Пайпер Курда",95.0,6.0,66 600
Джунгли. Райский переполох,Ostrov,https://www.kinopoisk.ru/film/5364319/,Рудольф Гавлик,Чехия,2023,комедия,"Яна Плодкова, Иржи Лангмайер",96.0,6.6,66 582
Хочу замуж,,https://www.kinopoisk.ru/film/4467988/,Соня Карпунина,Россия,2022,комедия,"Милош Бикович, Кристина Асмус",106.0,6.8,66 564
Одинокий мужчина,A Single Man,https://www.kinopoisk.ru/film/430593/,Том Форд,США,2009,триллер,"Колин Фёрт, Джулианна Мур",100.0,7.8,66 532
Наваждение,,https://www.kinopoisk.ru/film/265114/,Леонид Гайдай,СССР,1965,короткометражка,"Александр Демьяненко, Наталья Селезнёва",31.0,8.8,66 529
Убрать из друзей,Unfriended,https://www.kinopoisk.ru/film/839972/,Леван Габриадзе,США,2015,ужасы,"Шелли Хенниг, Моусес Сторм",82.0,5.6,66 509
Страшные сказки,Il racconto dei racconti - Tale of Tales,https://www.kinopoisk.ru/film/808175/,Маттео Гарроне,Италия,2015,ужасы,"Сальма Хайек, Венсан Кассель",135.0,6.4,66 471
Атлантида,Cold Skin,https://www.kinopoisk.ru/film/678639/,Ксавье Жанс,Испания,2016,ужасы,"Рэй Стивенсон, Дэвид Оукс",102.0,5.8,66 469
Дьявол всегда здесь,The Devil All the Time,https://www.kinopoisk.ru/film/1072788/,Антонио Кампос,США,2020,триллер,"Том Холланд, Билл Скарсгард",138.0,7.1,66 443
Серена,Serena,https://www.kinopoisk.ru/film/462525/,Сюзанна Бир,Франция,2014,драма,"Брэдли Купер, Дженнифер Лоуренс",109.0,6.3,66 440
Черновик,,https://www.kinopoisk.ru/film/893681/,Сергей Мокрицкий,Россия,2018,фантастика,"Никита Волков, Евгений Ткачук",116.0,5.2,66 253
Яйцо Фаберже,,https://www.kinopoisk.ru/film/4491514/,Илья Фарфель,Россия,2021,комедия,"Николай Наумов, Максим Лагашкин",88.0,5.7,66 217
Наёмник,American Assassin,https://www.kinopoisk.ru/film/708386/,Майкл Куэста,США,2017,боевик,"Дилан О’Брайен, Майкл Китон",111.0,6.4,66 144
Жуткая семейка,Una famiglia mostruosa,https://www.kinopoisk.ru/film/1355574/,Вольфанго Де Биази,Италия,2021,фэнтези,"Эмануэла Реи, Кристиано Каккамо",95.0,6.8,66 134
Что-то не так с Кевином,We Need to Talk About Kevin,https://www.kinopoisk.ru/film/465543/,Линн Рэмси,Великобритания,2010,триллер,"Тильда Суинтон, Джон Си Райли",112.0,7.1,66 120
Планета страха,Planet Terror,https://www.kinopoisk.ru/film/273063/,Роберт Родригес,США,2007,ужасы,"Роуз МакГоун, Фредди Родригес",95.0,6.7,66 115
Изгоняющий дьявола,The Exorcist,https://www.kinopoisk.ru/film/491/,Уильям Фридкин,США,1973,ужасы,"Эллен Бёрстин, Макс фон Сюдов",122.0,7.7,66 099
Она видела небо,Sora no Aosa o Shiru Hito yo,https://www.kinopoisk.ru/film/1249273/,Тацуюки Нагаи,Япония,2019,аниме,"Рихо Ёсиока, Сион Вакаяма",106.0,7.8,66 048
Первый день моей жизни,Il primo giorno della mia vita,https://www.kinopoisk.ru/film/1138971/,Паоло Дженовезе,Италия,2023,фэнтези,"Тони Сервилло, Валерио Мастандреа",121.0,7.8,66 046
