Хорошая женщина,A Good Woman,https://www.kinopoisk.ru/film/49966/,Майк Баркер,Великобритания,2004,драма,"Хелен Хант, Скарлетт Йоханссон",93.0,7.3,41 732
7 дней и ночей с Мэрилин,My Week with Marilyn,https://www.kinopoisk.ru/film/523002/,Саймон Кёртис,Великобритания,2011,драма,"Мишель Уильямс, Эдди Редмэйн",99.0,6.9,41 729
Запределье,The Fall,https://www.kinopoisk.ru/film/105813/,Тарсем Сингх,США,2006,фэнтези,"Ли Пейс, Катинка Унтару",117.0,7.6,41 697
Решала,,https://www.kinopoisk.ru/film/717355/,Роман Асхаев,Россия,2012,драма,"Александр Фролов, Константин Озеров",79.0,6.9,41 692
Приходите завтра...,,https://www.kinopoisk.ru/film/43250/,Евгений Ташков,СССР,1962,драма,"Екатерина Савинова, Анатолий Папанов",98.0,8.1,41 690
Петровы в гриппе,,https://www.kinopoisk.ru/film/1263423/,Кирилл Серебренников,Россия,2020,драма,"Семён Серзин, Чулпан Хаматова",145.0,6.8,41 652
Жандарм и инопланетяне,Le gendarme et les extra-terrestres,https://www.kinopoisk.ru/film/63685/,Жан Жиро,Франция,1978,фантастика,"Луи де Фюнес, Мишель Галабрю",96.0,7.7,41 629
Месть пушистых,Furry Vengeance,https://www.kinopoisk.ru/film/485351/,Роджер Камбл,Великобритания,2010,комедия,"Брендан Фрейзер, Рики Гарсиа",92.0,5.1,41 618
Завтра была война,,https://www.kinopoisk.ru/film/45244/,Юрий Кара,СССР,1987,драма,"Сергей Никоненко, Нина Русланова",89.0,8.1,41 604
Миллион лет до нашей эры,RRRrrrr!!!,https://www.kinopoisk.ru/film/50682/,Ален Шаба,Франция,2004,фантастика,"Марина Фоис, Жерар Депардье",98.0,6.6,41 590
Жаркие летние ночи,Hot Summer Nights,https://www.kinopoisk.ru/film/928993/,Элайджа Байнум,США,2017,драма,"Тимоти Шаламе, Майка Монро",107.0,6.8,41 587
Седьмая печать,Det sjunde inseglet,https://www.kinopoisk.ru/film/425/,Ингмар Бергман,Швеция,1957,фэнтези,"Гуннар Бьёрнстранд, Бенгт Экерот",96.0,8.1,41 560
Пи,Pi,https://www.kinopoisk.ru/film/8486/,Даррен Аронофски,США,1997,ужасы,"Шон Гуллет, Марк Марголис",84.0,7.5,41 545
Воспоминания о будущем,Testament of Youth,https://www.kinopoisk.ru/film/682688/,Джеймс Кент,Великобритания,2014,драма,"Алисия Викандер, Кит Харингтон",129.0,7.7,41 544
Гениальное ограбление,Way Down,https://www.kinopoisk.ru/film/1236795/,Жауме Балагеро,Испания,2020,боевик,"Фредди Хаймор, Астрид Берже-Фрисби",118.0,6.4,41 540
Прекрасные создания,Beautiful Creatures,https://www.kinopoisk.ru/film/489438/,Ричард ЛаГравенес,США,2013,фэнтези,"Элис Энглерт, Джереми Айронс",124.0,5.9,41 520
Чистилище,,https://www.kinopoisk.ru/film/252036/,Александр Невзоров,Россия,1997,боевик,"Виктор Степанов, Дмитрий Нагиев",115.0,7.8,41 510
Миссия невыполнима: Смертельная расплата. Часть первая,Mission: Impossible - Dead Reckoning Part One,https://www.kinopoisk.ru/film/1229684/,Кристофер Маккуорри,США,2023,боевик,"Том Круз, Хейли Этвелл",163.0,7.2,41 505
Астробой,Astro Boy,https://www.kinopoisk.ru/film/61323/,Дэвид Бауэрс,Гонконг,2009,мультфильм,"Шарлиз Терон, Фредди Хаймор",94.0,6.7,41 493
Эмили,Emily,https://www.kinopoisk.ru/film/1393432/,Фрэнсис О’Коннор,Великобритания,2022,драма,"Эмма Маки, Оливер Джексон-Коэн",130.0,7.3,41 491
Ничего себе каникулы!,Premières vacances,https://www.kinopoisk.ru/film/1062849/,Патрик Кассир,Франция,2018,комедия,"Джонатан Коэн, Камиль Шаму",102.0,6.2,41 490
Большая прогулка,La grande vadrouille,https://www.kinopoisk.ru/film/61815/,Жерар Ури,Франция,1966,комедия,"Бурвиль, Луи де Фюнес",123.0,8.1,41 484
Маленькая Италия,Little Italy,https://www.kinopoisk.ru/film/1069253/,Дональд Питри,Канада,2018,мелодрама,"Эмма Робертс, Хейден Кристенсен",102.0,6.8,41 467
Знакомьтесь: Дэйв,Meet Dave,https://www.kinopoisk.ru/film/267621/,Брайан Роббинс,США,2008,фантастика,"Эдди Мерфи, Элизабет Бэнкс",90.0,6.1,41 445
Опасный бизнес,Gringo,https://www.kinopoisk.ru/film/958501/,Нэш Эдгертон,Мексика,2018,боевик,"Дэвид Ойелоуо, Джоэл Эдгертон",111.0,6.6,41 434
Жихарка,,https://www.kinopoisk.ru/film/414903/,Олег Ужинов,Россия,2006,мультфильм,"Михаил Березовой, Екатерина Кудрявцева",12.0,7.9,41 418
Полный облом,Big Nothing,https://www.kinopoisk.ru/film/220497/,Жан-Батист Андреа,Великобритания,2006,триллер,"Дэвид Швиммер, Саймон Пегг",86.0,7.2,41 371
Анна и король,Anna and the King,https://www.kinopoisk.ru/film/5336/,Энди Теннант,США,1999,драма,"Джоди Фостер, Чоу Юнь-Фат",148.0,7.8,41 357
Последний отпуск,Last Holiday,https://www.kinopoisk.ru/film/81746/,Уэйн Ван,США,2006,драма,"Куин Латифа, ЭлЭл Кул Джей",112.0,7.6,41 327
Охотник на лис,Foxcatcher,https://www.kinopoisk.ru/film/638053/,Беннетт Миллер,США,2014,драма,"Стив Карелл, Ченнинг Татум",129.0,6.5,41 317
Дублёр,,https://www.kinopoisk.ru/film/679550/,Евгений Абызов,Россия,2012,комедия,"Александр Ревва, Кристина Асмус",83.0,5.2,41 311
Мистер Черч,Mr. Church,https://www.kinopoisk.ru/film/860683/,Брюс Бересфорд,США,2015,драма,"Эдди Мерфи, Бритт Робертсон",104.0,7.8,41 305
Двойной КОПец,Cop Out,https://www.kinopoisk.ru/film/449845/,Кевин Смит,США,2010,боевик,"Брюс Уиллис, Трэйси Морган",107.0,6.0,41 289
10 000 лет до н.э.,"10,000 BC",https://www.kinopoisk.ru/film/102611/,Роланд Эммерих,США,2008,фэнтези,"Стивен Стрейт, Камилла Белль",110.0,6.3,41 261
Суд над чикагской семеркой,The Trial of the Chicago 7,https://www.kinopoisk.ru/film/402981/,Аарон Соркин,США,2020,триллер,"Марк Райлэнс, Саша Барон Коэн",129.0,7.6,41 212
Непрощённая,The Unforgivable,https://www.kinopoisk.ru/film/1332577/,Нора Фингшайдт,Великобритания,2021,драма,"Сандра Буллок, Виола Дэвис",112.0,7.3,41 209
Таможня дает добро,Rien à déclarer,https://www.kinopoisk.ru/film/484623/,Дэни Бун,Франция,2010,комедия,"Бенуа Пульворд, Дэни Бун",108.0,7.1,41 196
Игрок,The Gambler,https://www.kinopoisk.ru/film/614227/,Руперт Уайатт,США,2014,триллер,"Марк Уолберг, Джон Гудман",111.0,6.2,41 195
Гол!,Goal!,https://www.kinopoisk.ru/film/50225/,Дэнни Кэннон,Великобритания,2005,мелодрама,"Куно Беккер, Стивен Диллэйн",118.0,7.7,41 160
"Фильм, фильм, фильм",,https://www.kinopoisk.ru/film/44416/,Фёдор Хитрук,СССР,1968,мультфильм,"Алексей Полевой, Георгий Вицин",19.0,8.3,41 152
Пост Мортем,Post Mortem,https://www.kinopoisk.ru/film/1247350/,Петер Бергенди,Венгрия,2020,ужасы,"Виктор Клем, Фружина Хаис",115.0,5.9,41 146
Целуя девушек,Kiss the Girls,https://www.kinopoisk.ru/film/1719/,Гэри Фледер,США,1997,триллер,"Морган Фриман, Эшли Джадд",116.0,7.1,41 135
Варвар,Barbarian,https://www.kinopoisk.ru/film/4749790/,Зак Креггер,США,2022,ужасы,"Джорджина Кэмпбелл, Билл Скарсгард",102.0,6.6,41 129
Нечестивые,The Unholy,https://www.kinopoisk.ru/film/1323019/,Эван Спилиотопулос,США,2021,ужасы,"Джеффри Дин Морган, Крикет Браун",99.0,6.0,41 120
Побег,,https://www.kinopoisk.ru/film/81203/,Егор Кончаловский,Россия,2005,триллер,"Евгений Миронов, Алексей Серебряков",110.0,6.8,41 115
Аквамен и потерянное царство,Aquaman and the Lost Kingdom,https://www.kinopoisk.ru/film/1234997/,Джеймс Ван,США,2023,фантастика,"Джейсон Момоа, Патрик Уилсон",124.0,6.1,41 115
Приключения Васи Куролесова,,https://www.kinopoisk.ru/film/259992/,Владимир Попов,СССР,1981,мультфильм,"Лев Дуров, Михаил Кононов",27.0,8.3,41 106
Синий бархат,Blue Velvet,https://www.kinopoisk.ru/film/5893/,Дэвид Линч,США,1986,триллер,"Изабелла Росселлини, Кайл Маклоклен",120.0,7.5,41 096
Смертельное оружие 4,Lethal Weapon 4,https://www.kinopoisk.ru/film/4002/,Ричард Доннер,США,1998,боевик,"Мэл Гибсон, Дэнни Гловер",122.0,7.6,41 055
Багровые реки 2: Ангелы апокалипсиса,Les rivières pourpres 2 - Les anges de l'apocalypse,https://www.kinopoisk.ru/film/5621/,Оливье Даан,Франция,2003,боевик,"Жан Рено, Бенуа Мажимель",100.0,6.9,41 036
Ритуал,The Ritual,https://www.kinopoisk.ru/film/1007990/,Дэвид Брукнер,Великобритания,2017,ужасы,"Рейф Сполл, Аршер Али",94.0,6.2,41 006
Темный мир в 3D,,https://www.kinopoisk.ru/film/447653/,Антон Мегердичев,Россия,2010,фэнтези,"Светлана Иванова, Иван Жидков",101.0,4.3,40 985
Пушистый шпион,Marnies Welt,https://www.kinopoisk.ru/film/993213/,Кристоф Лауэнштайн,Германия,2018,мультфильм,"Александра Нелдель, Аксель Праль",92.0,7.1,40 985
Воспитание чувств,An Education,https://www.kinopoisk.ru/film/404414/,Лоне Шерфиг,Великобритания,2008,драма,"Кэри Маллиган, Питер Сарсгаард",100.0,7.4,40 977
Папа,,https://www.kinopoisk.ru/film/80740/,Владимир Машков,Россия,2004,драма,"Владимир Машков, Егор Бероев",94.0,7.9,40 957
Однажды в Мексике: Отчаянный 2,Once Upon a Time in Mexico,https://www.kinopoisk.ru/film/6829/,Роберт Родригес,США,2003,боевик,"Антонио Бандерас, Сальма Хайек",102.0,6.9,40 943
Пароль: Хаус,H0us3,https://www.kinopoisk.ru/film/1212316/,Маноло Мунгуйя,Испания,2018,ужасы,"Мириам Тортоза, Мариона Тена",100.0,6.1,40 943
Смерть на Ниле,Death on the Nile,https://www.kinopoisk.ru/film/6751/,Джон Гиллермин,Великобритания,1978,драма,"Питер Устинов, Джейн Биркин",140.0,7.7,40 930
Смертный приговор,Death Sentence,https://www.kinopoisk.ru/film/256164/,Джеймс Ван,США,2007,боевик,"Кевин Бейкон, Гаррет Хедлунд",105.0,7.0,40 915
Мошенники,Serving Sara,https://www.kinopoisk.ru/film/2899/,Реджинальд Хадлин,Германия,2002,мелодрама,"Мэттью Перри, Элизабет Хёрли",102.0,7.0,40 885
Ага,Аға,https://www.kinopoisk.ru/film/4470985/,Фархат Серкебаев,Казахстан,2021,боевик,"Мурат Бисенбин, Азамат Ибраев",86.0,6.5,40 874
Шутки в сторону,De l'autre côté du périph,https://www.kinopoisk.ru/film/669982/,Давид Шарон,Франция,2012,комедия,"Омар Си, Лоран Лафитт",96.0,6.4,40 845
Глаз,The Eye,https://www.kinopoisk.ru/film/81965/,Давид Моро,Канада,2008,ужасы,"Джессика Альба, Алессандро Нивола",92.0,6.6,40 840
Эра выживания,Vesper,https://www.kinopoisk.ru/film/1400126/,Кристина Буожите,Франция,2022,драма,"Раффиелла Чепмен, Эдди Марсан",114.0,6.0,40 801
Младенец на $30 000 000,Bo bui gai wak,https://www.kinopoisk.ru/film/196952/,Бенни Чан,Гонконг,2006,боевик,"Джеки Чан, Луис Ку",136.0,7.1,40 790
Герда,,https://www.kinopoisk.ru/film/1311544/,Наталья Кудряшова,Россия,2021,драма,"Анастасия Красовская, Юра Борисов",116.0,5.8,40 783
Голос,Boychoir,https://www.kinopoisk.ru/film/806934/,Франсуа Жирар,США,2014,драма,"Дастин Хоффман, Кэти Бейтс",103.0,8.0,40 742
Плакса,Cry-Baby,https://www.kinopoisk.ru/film/7510/,Джон Уотерс,США,1990,мюзикл,"Джонни Депп, Эми Локейн",85.0,7.3,40 681
Стритрейсеры,,https://www.kinopoisk.ru/film/259281/,Олег Фесенко,Россия,2007,боевик,"Алексей Чадов, Марина Александрова",109.0,3.6,40 654
Зак и Мири снимают порно,Zack and Miri Make a Porno,https://www.kinopoisk.ru/film/405602/,Кевин Смит,США,2008,комедия,"Элизабет Бэнкс, Сет Роген",101.0,6.4,40 638
Возврат,Cashback,https://www.kinopoisk.ru/film/105878/,Шон Эллис,Великобритания,2005,драма,"Шон Биггерстаф, Эмилия Фокс",102.0,7.1,40 628
Широко шагая,Walking Tall,https://www.kinopoisk.ru/film/18102/,Кевин Брэй,США,2004,боевик,"Дуэйн Джонсон, Джонни Ноксвил",86.0,6.8,40 620
Катастрофа,Acide,https://www.kinopoisk.ru/film/5024757/,Жюст Филиппо,Франция,2023,фантастика,"Гийом Кане, Летиция Дош",99.0,5.4,40 597
Укол зонтиком,Le coup du parapluie,https://www.kinopoisk.ru/film/71058/,Жерар Ури,Франция,1980,комедия,"Пьер Ришар, Валери Мересс",98.0,7.7,40 592
Право на убийство,Righteous Kill,https://www.kinopoisk.ru/film/315168/,Джон Эвнет,США,2008,триллер,"Роберт Де Ниро, Аль Пачино",101.0,6.8,40 581
Джуниор,Junior,https://www.kinopoisk.ru/film/6301/,Айвен Райтман,США,1994,фантастика,"Арнольд Шварценеггер, Дэнни ДеВито",109.0,6.3,40 574
Большое путешествие,,https://www.kinopoisk.ru/film/1114973/,Василий Ровенский,Россия,2019,мультфильм,"Дмитрий Назаров, Максим Галкин",80.0,7.1,40 573
Непристойное предложение,Indecent Proposal,https://www.kinopoisk.ru/film/4346/,Эдриан Лайн,США,1993,драма,"Роберт Редфорд, Деми Мур",117.0,7.5,40 562
Маша и Медведь. Новогодние серии,,https://www.kinopoisk.ru/film/5231086/,Олег Ужинов,Россия,2022,мультфильм,"Алина Кукушкина, Эдуард Назаров",,8.6,40 555
Вне времени,Out of Time,https://www.kinopoisk.ru/film/6828/,Карл Франклин,США,2003,триллер,"Дензел Вашингтон, Ева Мендес",105.0,7.3,40 543
Путешествия Гулливера,Gulliver's Travels,https://www.kinopoisk.ru/film/432723/,Роб Леттерман,США,2010,фэнтези,"Джек Блэк, Джейсон Сигел",85.0,5.6,40 529
Призраки в Венеции,A Haunting in Venice,https://www.kinopoisk.ru/film/5135249/,Кеннет Брана,США,2023,детектив,"Кеннет Брана, Кайл Аллен",103.0,6.6,40 492
Забойный реванш,Grudge Match,https://www.kinopoisk.ru/film/543838/,Питер Сигал,США,2013,драма,"Роберт Де Ниро, Сильвестр Сталлоне",113.0,7.0,40 479
Убийца,The Killer,https://www.kinopoisk.ru/film/462656/,Дэвид Финчер,США,2023,триллер,"Майкл Фассбендер, Тильда Суинтон",118.0,6.6,40 421
Безумно богатые азиаты,Crazy Rich Asians,https://www.kinopoisk.ru/film/789174/,Джон М. Чу,США,2018,драма,"Констанс Ву, Генри Голдинг",120.0,6.8,40 400
Отчим,The Stepfather,https://www.kinopoisk.ru/film/258545/,Нельсон МакКормик,США,2009,триллер,"Дилан Уолш, Села Уорд",101.0,6.3,40 399
Дом у дороги,Road House,https://www.kinopoisk.ru/film/817167/,Даг Лайман,США,2024,боевик,"Джейк Джилленхол, Даниэла Мелшиор",121.0,6.4,40 372
Тихий садовник,Master Gardener,https://www.kinopoisk.ru/film/4541441/,Пол Шредер,США,2022,драма,"Джоэл Эдгертон, Сигурни Уивер",111.0,6.0,40 353
7 часов на соблазнение,7 ore per farti innamorare,https://www.kinopoisk.ru/film/1292635/,Джампаоло Морелли,Италия,2020,комедия,"Джампаоло Морелли, Серена Росси",104.0,6.6,40 349
Бабушка,La abuela,https://www.kinopoisk.ru/film/1393445/,Пако Пласа,Испания,2021,ужасы,"Альмудена Амор, Вера Вальдес",100.0,5.5,40 313
Неудержимый,Bullet to the Head,https://www.kinopoisk.ru/film/463475/,Уолтер Хилл,США,2012,боевик,"Сильвестр Сталлоне, Сон Ган",92.0,6.1,40 302
После Чернобыля,,https://www.kinopoisk.ru/film/667893/,Игорь Кинько,Россия,2021,ужасы,"Катрин Бадалян, Владимир Дыховичный",81.0,4.6,40 294
Последний король Шотландии,The Last King of Scotland,https://www.kinopoisk.ru/film/156002/,Кевин Макдональд,Великобритания,2006,триллер,"Форест Уитакер, Джеймс Макэвой",123.0,7.7,40 283
Разум и чувства,Sense and Sensibility,https://www.kinopoisk.ru/film/6148/,Энг Ли,Великобритания,1995,драма,"Эмма Томпсон, Кейт Уинслет",136.0,7.9,40 282
В гости к Робинсонам,Meet the Robinsons,https://www.kinopoisk.ru/film/70954/,Стивен Дж. Андерсон,США,2007,мультфильм,"Анджела Бассетт, Дэниэл Хансен",95.0,7.3,40 280
Угнать и продать,Rev,https://www.kinopoisk.ru/film/1309926/,Ант Хорасанли,Канада,2020,боевик,"Франческо Филиче, Вивика А. Фокс",91.0,6.2,40 273
Ночной беглец,Run All Night,https://www.kinopoisk.ru/film/662469/,Жауме Кольет-Серра,США,2015,боевик,"Лиам Нисон, Юэль Киннаман",114.0,6.6,40 257
Топор,,https://www.kinopoisk.ru/film/1043843/,Владимир Семеновых,Россия,2018,военный,"Андрей Смоляков, Дмитрий Шевченко",45.0,6.6,40 252
Проклятый дом,The Witch in the Window,https://www.kinopoisk.ru/film/994868/,Энди Миттон,США,2018,драма,"Алекс Дрэйпер, Чарльз Эверетт Такер",77.0,5.8,40 234
Идеальное убийство,A Perfect Murder,https://www.kinopoisk.ru/film/5504/,Эндрю Дэвис,США,1998,триллер,"Майкл Дуглас, Гвинет Пэлтроу",107.0,7.3,40 218
Губка Боб в 3D,The SpongeBob Movie: Sponge Out of Water,https://www.kinopoisk.ru/film/672398/,Пол Тиббит,США,2015,мультфильм,"Том Кенни, Билл Фагербакки",80.0,5.5,40 210
Семья года,,https://www.kinopoisk.ru/film/4326876/,Айнур Аскаров,Россия,2021,комедия,"Алмас Амиров, Ирина Бусыгина",90.0,6.6,40 128
Стена,Pink Floyd: The Wall,https://www.kinopoisk.ru/film/23712/,Алан Паркер,Великобритания,1982,мюзикл,"Боб Гелдоф, Кристин Харгривз",99.0,8.1,40 123
Подставной город,Jojakdoen dosi,https://www.kinopoisk.ru/film/1008532/,Пак Пэ-джон,Корея Южная,2017,боевик,"Чи Чхан-ук, Щим Ын-гён",126.0,7.3,40 123
Точка,,https://www.kinopoisk.ru/film/252125/,Юрий Мороз,Россия,2005,драма,"Дарья Мороз, Виктория Исакова",92.0,6.8,40 121
Человек-волк,The Wolfman,https://www.kinopoisk.ru/film/273293/,Джо Джонстон,США,2010,ужасы,"Бенисио Дель Торо, Энтони Хопкинс",119.0,6.1,40 107
В осаде 2: Темная территория,Under Siege 2: Dark Territory,https://www.kinopoisk.ru/film/4580/,Джефф Мерфи,США,1995,боевик,"Стивен Сигал, Эрик Богосян",100.0,7.0,40 087
Кубо. Легенда о самурае,Kubo and the Two Strings,https://www.kinopoisk.ru/film/882290/,Трэвис Найт,Великобритания,2016,мультфильм,"Арт Паркинсон, Шарлиз Терон",101.0,7.5,40 081
8 новых свиданий,,https://www.kinopoisk.ru/film/751916/,Марюс Вайсберг,Россия,2015,комедия,"Оксана Акиньшина, Владимир Зеленский",84.0,6.0,40 067
Эон Флакс,Æon Flux,https://www.kinopoisk.ru/film/77426/,Карин Кусама,США,2005,фантастика,"Шарлиз Терон, Мартон Чокаш",93.0,5.8,40 028
Стражи времени,Guardians of Time,https://www.kinopoisk.ru/film/4412061/,Стивен Шимек,США,2022,боевик,"Саманта Райан, Ава Торрес",99.0,5.8,39 976
Олдбой,Oldboy,https://www.kinopoisk.ru/film/431323/,Спайк Ли,США,2013,триллер,"Джош Бролин, Шарлто Копли",104.0,6.4,39 971
Навстречу шторму,Into the Storm,https://www.kinopoisk.ru/film/647948/,Стивен Куэйл,США,2014,приключения,"Ричард Армитедж, Сара Уэйн Кэллис",89.0,6.2,39 958
Безумное свидание,Date Night,https://www.kinopoisk.ru/film/445175/,Шон Леви,США,2010,триллер,"Стив Карелл, Тина Фей",88.0,6.5,39 942
Мой парень — киллер,Mr. Right,https://www.kinopoisk.ru/film/642609/,Пако Кабесас,США,2015,боевик,"Сэм Рокуэлл, Анна Кендрик",95.0,6.3,39 942
Чемпионы,,https://www.kinopoisk.ru/film/763746/,Алексей Вакулов,Россия,2014,спорт,"Марк Богатырев, Таисия Вилкова",100.0,5.9,39 942
Закрытые пространства,,https://www.kinopoisk.ru/film/414915/,Игорь Лебедев,Россия,2008,драма,"Леонид Бичевин, Мария Машкова",95.0,7.2,39 940
Крампус,Krampus,https://www.kinopoisk.ru/film/843104/,Майкл Догерти,США,2015,ужасы,"Эмджей Энтони, Адам Скотт",98.0,5.8,39 904
Yesterday,Yesterday,https://www.kinopoisk.ru/film/1144300/,Дэнни Бойл,Великобритания,2019,музыка,"Химеш Патель, Лили Джеймс",116.0,6.9,39 896
Махнемся телами,Le sens de la famille,https://www.kinopoisk.ru/film/1270780/,Жан-Патрик Бенес,Франция,2020,комедия,"Франк Дюбоск, Александра Лами",92.0,7.1,39 877
Горе-творец,The Disaster Artist,https://www.kinopoisk.ru/film/828242/,Джеймс Франко,США,2017,комедия,"Джеймс Франко, Дэйв Франко",104.0,7.5,39 841
Спаун,Spawn,https://www.kinopoisk.ru/film/5474/,Марк А.З. Диппе,США,1997,ужасы,"Майкл Джей Уайт, Джон Легуизамо",93.0,6.8,39 822
"Красивый, плохой, злой: Начало",Ted Bundy: American Boogeyman,https://www.kinopoisk.ru/film/4472589/,Дэниэл Фаррандс,США,2021,драма,"Чад Майкл Мюррэй, Холлэнд Роден",95.0,6.2,39 822
Цыплёнок Цыпа,Chicken Little,https://www.kinopoisk.ru/film/70953/,Марк Диндал,США,2005,мультфильм,"Зак Брафф, Гэрри Маршалл",81.0,6.3,39 817
