Нечто,The Thing,https://www.kinopoisk.ru/film/8366/,Джон Карпентер,США,1982,ужасы,"Курт Рассел, Кит Дэвид",109.0,7.9,145 249
Последний рубеж,Homefront,https://www.kinopoisk.ru/film/683766/,Гэри Фледер,США,2013,боевик,"Джейсон Стэйтем, Джеймс Франко",96.0,6.4,145 225
Крепкий орешек 2,Die Hard 2,https://www.kinopoisk.ru/film/7374/,Ренни Харлин,США,1990,боевик,"Брюс Уиллис, Бонни Беделиа",124.0,7.8,145 037
Лило и Стич,Lilo & Stitch,https://www.kinopoisk.ru/film/740/,Дин ДеБлуа,США,2002,мультфильм,"Дэйви Чейз, Крис Сандерс",85.0,7.8,144 908
Легенда о Зелёном Рыцаре,The Green Knight,https://www.kinopoisk.ru/film/1209476/,Дэвид Лоури,США,2020,фэнтези,"Дев Патель, Алисия Викандер",130.0,6.2,144 700
Карлсон вернулся,,https://www.kinopoisk.ru/film/44718/,Борис Степанцев,СССР,1970,мультфильм,"Фаина Раневская, Василий Ливанов",20.0,8.5,144 685
Место под соснами,The Place Beyond the Pines,https://www.kinopoisk.ru/film/577673/,Дерек Сиенфрэнс,США,2012,триллер,"Райан Гослинг, Брэдли Купер",140.0,7.3,144 632
Инферно,Inferno,https://www.kinopoisk.ru/film/780470/,Рон Ховард,США,2016,боевик,"Том Хэнкс, Фелисити Джонс",121.0,6.5,144 561
Не говори никому,Ne le dis à personne,https://www.kinopoisk.ru/film/22936/,Гийом Кане,Франция,2006,триллер,"Франсуа Клюзе, Мари-Жозе Кроз",131.0,7.4,144 188
После. Долго и счастливо,After Ever Happy,https://www.kinopoisk.ru/film/1411988/,Кастиль Лэндон,США,2022,мелодрама,"Джозефин Лэнгфорд, Хиро Файнс Тиффин",95.0,6.0,144 149
Маленький принц,Le Petit Prince,https://www.kinopoisk.ru/film/572553/,Марк Осборн,Франция,2015,мультфильм,"Джефф Бриджес, Маккензи Фой",108.0,8.1,144 107
Плохие парни 2,Bad Boys II,https://www.kinopoisk.ru/film/2928/,Майкл Бэй,США,2003,боевик,"Уилл Смит, Мартин Лоуренс",141.0,7.6,144 030
Кролик Джоджо,Jojo Rabbit,https://www.kinopoisk.ru/film/726838/,Тайка Вайтити,Новая Зеландия,2019,комедия,"Роман Гриффин Дэвис, Томасин Маккензи",108.0,7.9,143 886
Дневной дозор,,https://www.kinopoisk.ru/film/79925/,Тимур Бекмамбетов,Россия,2005,фэнтези,"Константин Хабенский, Мария Порошина",132.0,6.1,143 697
Одноклассники,Grown Ups,https://www.kinopoisk.ru/film/450345/,Деннис Дуган,США,2010,комедия,"Адам Сэндлер, Кевин Джеймс",102.0,6.8,143 575
История игрушек 4,Toy Story 4,https://www.kinopoisk.ru/film/846824/,Джош Кули,США,2019,мультфильм,"Том Хэнкс, Тим Аллен",100.0,7.7,143 534
Угнать за 60 секунд,Gone in Sixty Seconds,https://www.kinopoisk.ru/film/2011/,Доминик Сена,США,2000,боевик,"Николас Кейдж, Анджелина Джоли",118.0,7.6,143 526
Шерлок Холмс и доктор Ватсон: Кровавая надпись,,https://www.kinopoisk.ru/film/77265/,Игорь Масленников,СССР,1979,криминал,"Василий Ливанов, Виталий Соломин",66.0,8.4,143 465
Бумер: Фильм второй,,https://www.kinopoisk.ru/film/79883/,Пётр Буслов,Россия,2006,драма,"Владимир Вдовиченков, Светлана Устинова",115.0,6.1,143 449
Духless,,https://www.kinopoisk.ru/film/395372/,Роман Прыгунов,Россия,2011,драма,"Данила Козловский, Мария Андреева",105.0,6.7,143 414
Родители строгого режима,,https://www.kinopoisk.ru/film/4907342/,Никита Владимиров,Россия,2022,комедия,"Алиса Фрейндлих, Александр Адабашьян",79.0,7.2,143 358
"Кловерфилд, 10",10 Cloverfield Lane,https://www.kinopoisk.ru/film/843463/,Дэн Трахтенберг,США,2016,триллер,"Джон Гудман, Мэри Элизабет Уинстэд",103.0,6.9,143 269
Миссия невыполнима: Протокол Фантом,Mission: Impossible - Ghost Protocol,https://www.kinopoisk.ru/film/472362/,Брэд Бёрд,США,2011,боевик,"Том Круз, Пола Пэттон",132.0,7.3,143 177
После. Глава 3,After We Fell,https://www.kinopoisk.ru/film/1406473/,Кастиль Лэндон,США,2021,драма,"Джозефин Лэнгфорд, Хиро Файнс Тиффин",98.0,5.9,143 070
Конец славы,,https://www.kinopoisk.ru/film/5089024/,Марюс Вайсберг,Россия,2023,комедия,"Павел Деревянко, Сергей Чирков",95.0,6.8,142 838
Энканто,Encanto,https://www.kinopoisk.ru/film/775278/,Джаред Буш,США,2021,мультфильм,"Стефани Беатриз, Мария Сесилия Ботеро",102.0,7.5,142 703
Любовь и другие лекарства,Love & Other Drugs,https://www.kinopoisk.ru/film/463695/,Эдвард Цвик,США,2010,драма,"Джейк Джилленхол, Энн Хэтэуэй",113.0,6.9,142 682
Starперцы,Last Vegas,https://www.kinopoisk.ru/film/468571/,Джон Тёртлтауб,США,2013,комедия,"Майкл Дуглас, Роберт Де Ниро",105.0,6.9,142 668
Пассажир,The Commuter,https://www.kinopoisk.ru/film/497011/,Жауме Кольет-Серра,США,2018,боевик,"Лиам Нисон, Вера Фармига",104.0,6.8,142 634
Полицейская академия,Police Academy,https://www.kinopoisk.ru/film/21205/,Хью Уилсон,США,1984,комедия,"Стив Гуттенберг, Ким Кэтролл",92.0,7.9,142 420
На крючке,Eagle Eye,https://www.kinopoisk.ru/film/387477/,Ди Джей Карузо,Германия,2008,фантастика,"Шайа ЛаБаф, Мишель Монахэн",118.0,7.4,142 119
Проклятие монахини,The Nun,https://www.kinopoisk.ru/film/991225/,Корин Харди,США,2018,ужасы,"Демиан Бичир, Таисса Фармига",96.0,5.7,141 956
Наркокурьер,The Mule,https://www.kinopoisk.ru/film/1142526/,Клинт Иствуд,США,2018,триллер,"Клинт Иствуд, Брэдли Купер",116.0,7.3,141 802
Сердцеедки,Heartbreakers,https://www.kinopoisk.ru/film/692/,Дэвид Миркин,США,2001,мелодрама,"Сигурни Уивер, Дженнифер Лав Хьюитт",123.0,7.2,141 712
Страшно красив,Beastly,https://www.kinopoisk.ru/film/450470/,Даниел Барнз,США,2011,фэнтези,"Алекс Петтифер, Ванесса Энн Хадженс",86.0,6.2,141 558
Ип Ман 4,Yip Man 4,https://www.kinopoisk.ru/film/634254/,Уилсон Ип,Гонконг,2019,боевик,"Донни Йен, Дэнни Чань",107.0,7.8,141 331
Лысый нянька: Спецзадание,The Pacifier,https://www.kinopoisk.ru/film/77450/,Адам Шенкман,США,2005,боевик,"Вин Дизель, Лорен Грэм",95.0,6.7,141 092
Мальчишник: Часть III,The Hangover Part III,https://www.kinopoisk.ru/film/600847/,Тодд Филлипс,США,2013,комедия,"Брэдли Купер, Эд Хелмс",100.0,6.4,141 062
Эйс Вентура 2: Когда зовет природа,Ace Ventura: When Nature Calls,https://www.kinopoisk.ru/film/3679/,Стив Одекерк,США,1995,комедия,"Джим Керри, Иэн МакНис",90.0,7.3,140 985
Счастливого дня смерти,Happy Death Day,https://www.kinopoisk.ru/film/1012421/,Кристофер Лэндон,США,2017,ужасы,"Джессика Рот, Израэль Бруссар",96.0,6.6,140 863
Тарас Бульба,,https://www.kinopoisk.ru/film/161104/,Владимир Бортко,Россия,2009,боевик,"Богдан Ступка, Игорь Петренко",131.0,6.6,140 819
Еще одна из рода Болейн,The Other Boleyn Girl,https://www.kinopoisk.ru/film/195435/,Джастин Чадвик,Великобритания,2008,драма,"Натали Портман, Скарлетт Йоханссон",110.0,7.7,140 806
Лев Яшин. Вратарь моей мечты,,https://www.kinopoisk.ru/film/1007986/,Василий Чигинский,Россия,2019,биография,"Александр Фокин, Юлия Хлынина",120.0,7.6,140 783
Приглашение к убийству,Invitation to a Murder,https://www.kinopoisk.ru/film/4746012/,Стивен Шимек,Франция,2022,триллер,"Миша Бартон, Крис Браунинг",92.0,6.5,140 767
Братья Гримм,The Brothers Grimm,https://www.kinopoisk.ru/film/13469/,Терри Гиллиам,США,2005,фэнтези,"Мэтт Дэймон, Хит Леджер",118.0,7.0,140 494
Каникулы президента,,https://www.kinopoisk.ru/film/1047726/,Илья Шерстобитов,Россия,2018,комедия,"Олег Васильков, Анна Цуканова-Котт",105.0,6.2,140 338
Хроники Нарнии: Покоритель Зари,The Chronicles of Narnia: The Voyage of the Dawn Treader,https://www.kinopoisk.ru/film/281439/,Майкл Аптед,США,2010,фэнтези,"Бен Барнс, Скандар Кейнс",112.0,6.9,140 326
Доктор Сон,Doctor Sleep,https://www.kinopoisk.ru/film/1048255/,Майк Флэнаган,США,2019,триллер,"Юэн Макгрегор, Ребекка Фергюсон",152.0,7.3,140 259
Мы купили зоопарк,We Bought a Zoo,https://www.kinopoisk.ru/film/464413/,Кэмерон Кроу,США,2011,драма,"Мэтт Дэймон, Скарлетт Йоханссон",124.0,7.7,140 055
Годзилла против Конга,Godzilla vs. Kong,https://www.kinopoisk.ru/film/965936/,Адам Вингард,США,2021,боевик,"Александр Скарсгард, Милли Бобби Браун",113.0,6.2,139 755
Больше чем секс,No Strings Attached,https://www.kinopoisk.ru/film/502937/,Айвен Райтман,США,2010,мелодрама,"Натали Портман, Эштон Кутчер",108.0,6.8,139 718
Враг государства,Enemy of the State,https://www.kinopoisk.ru/film/3954/,Тони Скотт,США,1998,боевик,"Уилл Смит, Джин Хэкмен",132.0,7.8,139 678
Летят журавли,,https://www.kinopoisk.ru/film/7724/,Михаил Калатозов,СССР,1957,военный,"Татьяна Самойлова, Алексей Баталов",95.0,8.3,139 432
Need for Speed: Жажда скорости,Need for Speed,https://www.kinopoisk.ru/film/678975/,Скотт Во,США,2014,боевик,"Аарон Пол, Доминик Купер",130.0,6.8,139 334
Волк и теленок,,https://www.kinopoisk.ru/film/260226/,Михаил Каменецкий,СССР,1984,мультфильм,"Олег Табаков, Ольга Громова",10.0,8.6,139 267
Призрачная красота,Collateral Beauty,https://www.kinopoisk.ru/film/915112/,Дэвид Фрэнкел,США,2016,драма,"Уилл Смит, Эдвард Нортон",97.0,7.2,139 261
Золотой телёнок,,https://www.kinopoisk.ru/film/45389/,Михаил Швейцер,СССР,1968,комедия,"Сергей Юрский, Леонид Куравлёв",164.0,8.2,139 158
Angry Birds в кино,The Angry Birds Movie,https://www.kinopoisk.ru/film/609618/,Клэй Кэйтис,Финляндия,2016,мультфильм,"Джейсон Судейкис, Джош Гэд",97.0,6.3,139 052
Укрась прощальное утро цветами обещания,Sayonara no asa ni yakusoku no hana o kazaro,https://www.kinopoisk.ru/film/1103852/,Мари Окада,Япония,2018,аниме,"Манака Ивами, Мию Ирино",115.0,8.2,138 970
Превосходство Борна,The Bourne Supremacy,https://www.kinopoisk.ru/film/41947/,Пол Гринграсс,США,2004,боевик,"Мэтт Дэймон, Карл Урбан",108.0,7.7,138 931
Крепкий орешек 4.0,Live Free or Die Hard,https://www.kinopoisk.ru/film/9544/,Лен Уайзман,США,2007,боевик,"Брюс Уиллис, Джастин Лонг",128.0,7.3,138 552
Недруги,Hostiles,https://www.kinopoisk.ru/film/963016/,Скотт Купер,США,2017,драма,"Кристиан Бэйл, Розамунд Пайк",134.0,7.4,138 361
Большой Стэн,Big Stan,https://www.kinopoisk.ru/film/231150/,Роб Шнайдер,США,2007,боевик,"Роб Шнайдер, Дэвид Кэрредин",104.0,6.9,138 251
Нефть,There Will Be Blood,https://www.kinopoisk.ru/film/196604/,Пол Томас Андерсон,США,2007,драма,"Дэниэл Дэй-Льюис, Пол Дано",158.0,7.8,138 250
"Влюбись в меня, если осмелишься",Jeux d'enfants,https://www.kinopoisk.ru/film/63920/,Ян Самюэль,Франция,2003,драма,"Гийом Кане, Марион Котийяр",90.0,7.7,138 117
Судная ночь,The Purge,https://www.kinopoisk.ru/film/661022/,Джеймс ДеМонако,США,2013,триллер,"Итан Хоук, Лина Хиди",85.0,6.0,138 087
Человек-швейцарский нож,Swiss Army Man,https://www.kinopoisk.ru/film/918087/,Дэн Кван,США,2016,фэнтези,"Пол Дано, Дэниэл Рэдклифф",97.0,6.8,138 069
Балерина,Ballerina,https://www.kinopoisk.ru/film/674249/,Эрик Саммер,Канада,2016,мультфильм,"Эль Фаннинг, Дэйн ДеХаан",89.0,7.3,137 970
Иван Царевич и Серый Волк 2,,https://www.kinopoisk.ru/film/707217/,Владимир Торопчин,Россия,2013,мультфильм,"Никита Ефремов, Татьяна Бунина",70.0,5.4,137 885
"Варвара-краса, длинная коса",,https://www.kinopoisk.ru/film/45665/,Александр Роу,СССР,1970,фэнтези,"Михаил Пуговкин, Георгий Милляр",80.0,8.2,137 859
Обитель зла 2: Апокалипсис,Resident Evil: Apocalypse,https://www.kinopoisk.ru/film/24186/,Александр Уитт,Германия,2004,ужасы,"Милла Йовович, Сиенна Гиллори",94.0,6.8,137 789
Роковое число 23,The Number 23,https://www.kinopoisk.ru/film/178579/,Джоэл Шумахер,США,2006,триллер,"Джим Керри, Вирджиния Мэдсен",98.0,7.1,137 743
Семья по-быстрому,Instant Family,https://www.kinopoisk.ru/film/1108494/,Шон Андерс,США,2018,драма,"Марк Уолберг, Роуз Бирн",118.0,7.5,137 709
Парни со стволами,War Dogs,https://www.kinopoisk.ru/film/602749/,Тодд Филлипс,США,2016,драма,"Майлз Теллер, Джона Хилл",114.0,6.9,137 413
Легион,Legion,https://www.kinopoisk.ru/film/426002/,Скотт Чарльз Стюарт,США,2010,ужасы,"Пол Беттани, Лукас Блэк",100.0,5.6,137 406
Бука. Моё любимое чудище,,https://www.kinopoisk.ru/film/893508/,Виктор Глухушин,Россия,2021,мультфильм,"Любовь Аксёнова, Алексей Чумаков",98.0,7.7,137 263
Величайший шоумен,The Greatest Showman,https://www.kinopoisk.ru/film/470173/,Майкл Грэйси,США,2017,драма,"Хью Джекман, Мишель Уильямс",105.0,7.6,137 174
Сладкий ноябрь,Sweet November,https://www.kinopoisk.ru/film/3795/,Пэт О’Коннор,США,2001,драма,"Киану Ривз, Шарлиз Терон",119.0,7.7,137 117
Тайна печати дракона,,https://www.kinopoisk.ru/film/840758/,Олег Степченко,Россия,2019,приключения,"Джейсон Флеминг, Арнольд Шварценеггер",121.0,5.9,137 020
Холодное лето пятьдесят третьего...,,https://www.kinopoisk.ru/film/7660/,Александр Прошкин,СССР,1987,драма,"Валерий Приёмыхов, Анатолий Папанов",102.0,8.2,136 983
Защитник,Safe,https://www.kinopoisk.ru/film/523057/,Боаз Якин,США,2012,боевик,"Джейсон Стэйтем, Катрин Чан",94.0,6.7,136 947
Маугли,,https://www.kinopoisk.ru/film/14000/,Роман Давыдов,СССР,1973,мультфильм,"Степан Бубнов, Людмила Касаткина",90.0,7.9,136 895
Девушка в поезде,The Girl on the Train,https://www.kinopoisk.ru/film/928391/,Тейт Тейлор,США,2016,триллер,"Эмили Блант, Хейли Беннетт",112.0,6.6,136 790
Воспоминания об убийстве,Salinui chueok,https://www.kinopoisk.ru/film/65770/,Пон Джун-хо,Корея Южная,2003,детектив,"Сон Кан-хо, Ким Сан-гён",131.0,7.6,136 673
Фантастическая четверка,Fantastic Four,https://www.kinopoisk.ru/film/23263/,Тим Стори,Германия,2005,фантастика,"Йоан Гриффит, Джессика Альба",106.0,6.7,136 503
К звёздам,Ad Astra,https://www.kinopoisk.ru/film/768561/,Джеймс Грэй,США,2019,фантастика,"Брэд Питт, Томми Ли Джонс",123.0,6.4,136 200
Миллионер поневоле,Mr. Deeds,https://www.kinopoisk.ru/film/4186/,Стивен Брилл,США,2002,мелодрама,"Адам Сэндлер, Вайнона Райдер",96.0,6.9,135 941
Человек-паук: Паутина вселенных,Spider-Man: Across the Spider-Verse,https://www.kinopoisk.ru/film/1219177/,Жуакин Душ Сантуш,США,2023,мультфильм,"Шамеик Мур, Хейли Стайнфелд",140.0,8.4,135 872
Нокдаун,Cinderella Man,https://www.kinopoisk.ru/film/12244/,Рон Ховард,США,2005,драма,"Рассел Кроу, Рене Зеллвегер",144.0,8.2,135 836
Апокалипсис сегодня,Apocalypse Now,https://www.kinopoisk.ru/film/354/,Фрэнсис Форд Коппола,США,1979,военный,"Марлон Брандо, Мартин Шин",194.0,8.1,135 732
Хищники,Predators,https://www.kinopoisk.ru/film/460523/,Нимрод Антал,США,2010,фантастика,"Эдриан Броуди, Тофер Грейс",107.0,6.5,135 712
Гараж,,https://www.kinopoisk.ru/film/44467/,Эльдар Рязанов,СССР,1979,драма,"Валентин Гафт, Ия Саввина",96.0,8.1,135 694
Обитель теней,Marrowbone,https://www.kinopoisk.ru/film/992500/,Серхио Х. Санчес,Испания,2017,ужасы,"Джордж Маккэй, Аня Тейлор-Джой",110.0,7.1,135 663
Бриджит Джонс: Грани разумного,Bridget Jones: The Edge of Reason,https://www.kinopoisk.ru/film/48173/,Бибан Кидрон,Великобритания,2004,драма,"Рене Зеллвегер, Колин Фёрт",108.0,7.2,135 439
"Облачно, возможны осадки в виде фрикаделек",Cloudy with a Chance of Meatballs,https://www.kinopoisk.ru/film/276363/,Фил Лорд,США,2009,мультфильм,"Билл Хейдер, Анна Фэрис",90.0,6.9,135 381
Призрачный гонщик 2,Ghost Rider: Spirit of Vengeance,https://www.kinopoisk.ru/film/391886/,Марк Невелдайн,США,2012,фэнтези,"Николас Кейдж, Киран Хайндс",96.0,4.9,135 208
Ограбление по-итальянски,The Italian Job,https://www.kinopoisk.ru/film/318/,Ф. Гэри Грей,США,2003,боевик,"Шарлиз Терон, Марк Уолберг",111.0,7.6,135 206
Геошторм,Geostorm,https://www.kinopoisk.ru/film/597129/,Дин Девлин,США,2017,фантастика,"Джерард Батлер, Джим Стёрджесс",109.0,5.8,135 137
Великолепная семерка,The Magnificent Seven,https://www.kinopoisk.ru/film/682648/,Антуан Фукуа,США,2016,вестерн,"Дензел Вашингтон, Крис Пратт",132.0,6.8,135 109
Черепашки-ниндзя 2,Teenage Mutant Ninja Turtles: Out of the Shadows,https://www.kinopoisk.ru/film/841518/,Дэйв Грин,США,2016,фантастика,"Меган Фокс, Уилл Арнетт",112.0,6.1,135 066
Джунгли,Jungle,https://www.kinopoisk.ru/film/893843/,Грег МакЛин,Австралия,2017,триллер,"Дэниэл Рэдклифф, Томас Кречман",115.0,7.0,134 772
Запрещенный прием,Sucker Punch,https://www.kinopoisk.ru/film/429827/,Зак Снайдер,США,2011,фэнтези,"Эмили Браунинг, Эбби Корниш",110.0,6.6,134 662
Монстро,Cloverfield,https://www.kinopoisk.ru/film/374718/,Мэтт Ривз,США,2007,ужасы,"Лиззи Каплан, Джессика Лукас",81.0,6.9,134 615
Мальчик в девочке,It's a Boy Girl Thing,https://www.kinopoisk.ru/film/195272/,Ник Харран,США,2006,фэнтези,"Самира Армстронг, Кевин Зегерс",95.0,6.8,134 518
Жить,,https://www.kinopoisk.ru/film/521526/,Юрий Быков,Россия,2010,триллер,"Денис Шведов, Владислав Толдыков",72.0,7.3,134 516
Робокоп,RoboCop,https://www.kinopoisk.ru/film/7410/,Пол Верховен,США,1987,фантастика,"Питер Уэллер, Нэнси Аллен",102.0,7.6,134 440
Мавританец,The Mauritanian,https://www.kinopoisk.ru/film/1289785/,Кевин Макдональд,Великобритания,2020,биография,"Джоди Фостер, Тахар Рахим",129.0,7.7,134 422
Сапожник,The Cobbler,https://www.kinopoisk.ru/film/801924/,Том Маккарти,США,2014,фэнтези,"Адам Сэндлер, Метод Мэн",98.0,6.4,134 321
Бендер: Начало,,https://www.kinopoisk.ru/film/1305913/,Игорь Зайцев,Россия,2021,приключения,"Сергей Безруков, Арам Вардеванян",96.0,6.9,134 287
Тело Дженнифер,Jennifer's Body,https://www.kinopoisk.ru/film/404510/,Карин Кусама,США,2009,ужасы,"Меган Фокс, Аманда Сайфред",102.0,5.7,134 258
Изумительный Морис,The Amazing Maurice,https://www.kinopoisk.ru/film/1450722/,Тоби Генкель,Великобритания,2022,мультфильм,"Хью Лори, Эмилия Кларк",93.0,7.3,134 226
Жизнь прекрасна,50/50,https://www.kinopoisk.ru/film/462515/,Джонатан Левин,США,2011,драма,"Джозеф Гордон-Левитт, Сет Роген",100.0,7.5,133 939
Тихая гавань,Safe Haven,https://www.kinopoisk.ru/film/557437/,Лассе Халльстрём,США,2013,триллер,"Джулианна Хаф, Джош Дюамель",115.0,7.2,133 860
Три плюс два,,https://www.kinopoisk.ru/film/46792/,Генрих Оганисян,СССР,1963,мелодрама,"Наталья Кустинская, Наталья Фатеева",99.0,8.0,133 681
Двенадцать месяцев,,https://www.kinopoisk.ru/film/46788/,Иван Иванов-Вано,СССР,1956,мультфильм,"Татьяна Барышева, Юлия Юльская",55.0,8.1,133 551
Римские каникулы,Roman Holiday,https://www.kinopoisk.ru/film/497/,Уильям Уайлер,США,1953,мелодрама,"Грегори Пек, Одри Хепберн",118.0,8.3,133 530
Психо,Psycho,https://www.kinopoisk.ru/film/344/,Альфред Хичкок,США,1960,триллер,"Энтони Перкинс, Вера Майлз",109.0,8.1,133 497
Песнь моря,Song of the Sea,https://www.kinopoisk.ru/film/714248/,Томм Мур,Ирландия,2014,мультфильм,"Дэвид Роул, Брендан Глисон",93.0,8.2,133 408
Форма голоса,Koe no katachi,https://www.kinopoisk.ru/film/963343/,Наоко Ямада,Япония,2016,аниме,"Мию Ирино, Саори Хаями",130.0,8.2,133 408
Белый Бим Черное ухо,,https://www.kinopoisk.ru/film/46068/,Станислав Ростоцкий,СССР,1976,драма,"Вячеслав Тихонов, Валентина Владимирова",183.0,8.4,133 376
Сад изящных слов,Koto no ha no niwa,https://www.kinopoisk.ru/film/730665/,Макото Синкай,Япония,2013,аниме,"Мию Ирино, Кана Ханадзава",46.0,7.9,133 346
Превосходство,Transcendence,https://www.kinopoisk.ru/film/687670/,Уолли Пфистер,Великобритания,2014,фантастика,"Джонни Депп, Ребекка Холл",119.0,6.5,133 345
